{
  "$schema": "quiz-project.schema.json",
  "format": "quiz-project",
  "version": 3,
  "id": "08e77a4d-227a-45da-8599-abce3f07dfa5",
  "name": "Demoquiz – små klurigheter",
  "savedAt": 1791331200000,
  "branding": {
    "brandName": "QUIZ",
    "subtitle": "Tre frågor att prova tillsammans",
    "welcomeTitle": "Små klurigheter. Stora laginsatser.",
    "welcomeText": "Bilda ett lag och välj en mobil att svara med. Tre korta frågor väntar!",
    "joinTitle": "Ett lag.\nAlla möjligheter.",
    "joinText": "En mobil per lag. Ett svar att enas om.",
    "teamPlaceholder": "Till exempel: Snilleblixtarna",
    "hostEyebrow": "DEMOQUIZ · REDO ATT PROVA",
    "hostTitle": "Välkommen till Quizmotor.",
    "questionsText": "En gåta med tidsstyrda ledtrådar, en bonusfråga och en final med satsning.",
    "readyTitle": "Är ni redo?",
    "leaderboardTitle": "Vem tar täten?",
    "finalTitle": "Vilket lag!",
    "intermissionText": "Kunskap. Magkänsla. Laganda.",
    "closingText": "Tack för att ni provade! Nu är det er tur att skapa ett quiz.",
    "footer": "Demoquiz – små klurigheter",
    "teamFooter": "Demoquiz – små klurigheter",
    "timesUpLabel": "SLÄPP TELEFONERNA",
    "timesUpTitle": "TIME’S\nUP!",
    "theme": {
      "background": "#101214",
      "surface": "#191c1f",
      "foreground": "#f3f4f1",
      "muted": "#a5adaf",
      "accent": "#ccff5f",
      "board": "#202079",
      "alert": "#fb896c",
      "symbol": "audio",
      "typography": "sans",
      "pattern": "diagonal"
    },
    "logo": null,
    "backdrop": null
  },
  "questions": [
    {
      "id": "demo-svampen",
      "title": "Full av hål",
      "prompt": "Jag är full av hål men kan ändå hålla vatten. Vad är jag?",
      "answer": "En svamp",
      "explanation": "En svamp suger upp vatten i sina porer. Godkänn också tvättsvamp eller disksvamp.",
      "hint": "Tänk på något som hjälper till vid diskhon.",
      "kind": "music",
      "duration": 120,
      "maxPoints": 100,
      "offset": 0,
      "audio": null,
      "image": null,
      "picture": null,
      "video": null,
      "audioSource": "local",
      "appleMusic": null,
      "cues": [
        {
          "id": "svampen-1",
          "at": 20,
          "text": "Jag blir tyngre när jag hjälper till.",
          "image": null,
          "video": null
        },
        {
          "id": "svampen-2",
          "at": 50,
          "text": "Jag finns ofta vid diskhon.",
          "image": null,
          "video": null
        },
        {
          "id": "svampen-3",
          "at": 90,
          "text": "Jag är mjuk, porös och suger åt mig.",
          "image": null,
          "video": null
        }
      ],
      "example": true
    },
    {
      "id": "demo-kopparna",
      "title": "Robotens fikapaus",
      "prompt": "En robot dukar fram sex staplar med sju koppar i varje. Hur många koppar står på bordet?",
      "answer": "42",
      "explanation": "6 × 7 = 42. Alla rätta svar på en bonusfråga ger samma poäng, oavsett hur snabbt laget svarar.",
      "hint": "Sex gånger sju.",
      "kind": "bonus",
      "duration": 60,
      "maxPoints": 150,
      "offset": 0,
      "audio": null,
      "image": null,
      "picture": null,
      "video": null,
      "audioSource": "local",
      "appleMusic": null,
      "cues": [],
      "example": true
    },
    {
      "id": "demo-finalen",
      "title": "Final: kalenderkollen",
      "prompt": "Hur många av årets månader har minst 28 dagar?",
      "answer": "12",
      "explanation": "Alla tolv månader har minst 28 dagar. Vid rätt svar vinner laget sin satsning; vid fel svar förlorar laget den.",
      "hint": "Läs ordet ”minst” en gång till.",
      "kind": "wager",
      "duration": 60,
      "maxPoints": 100,
      "offset": 0,
      "audio": null,
      "image": null,
      "picture": null,
      "video": null,
      "audioSource": "local",
      "appleMusic": null,
      "cues": [],
      "example": true
    }
  ],
  "show": {
    "musicVolume": 80,
    "talkVolume": 22,
    "talking": false,
    "bedVolume": 30,
    "effectVolume": 65,
    "bedAudio": null,
    "bedTracks": [],
    "closingAudio": null,
    "bedEnabled": true
  }
}
